### ISSUE TITLE
Add test for SSLv23 only for web_connectivity

### ISSUE THREAD

**Issue by bassosimone** [measurement-kit/measurement-kit#1311]
See #1228.

The test should make sure that web_connectivity can access SSLv2 hosts whereas we cannot normally access SSLv2 or SSLv3 hosts when not using web_connectivity.

**Comment by bassosimone** [comment]
I initially wrote the following diff:

```diff
diff --git a/test/http/request.cpp b/test/http/request.cpp
index 4ced7323..8431921a 100644
--- a/test/http/request.cpp
+++ b/test/http/request.cpp
@@ -717,6 +717,38 @@ TEST_CASE("http::request_send fails without url in settings") {
     });
 }
 
+TEST_CASE("Make sure by default we don't connect to SSLv{2,3} sites") {
+    auto logger = Logger::global();
+
+    // See https://github.com/chromium/badssl.com/issues/20
+
+    SECTION("For SSLv2") {
+        auto reactor = Reactor::global();
+        Error err;
+        get("https://ssl-v2.badssl.com:1002",
+                [&](Error e, SharedPtr<Response>) {
+                    err = e;
+                    reactor->stop();
+                },
+                Headers{}, Settings{}, reactor, logger);
+        reactor->run();
+        REQUIRE(err == SslError());
+    }
+
+    SECTION("For SSLv3") {
+        auto reactor = Reactor::global();
+        Error err;
+        get("https://ssl-v3.badssl.com:1003",
+                [&](Error e, SharedPtr<Response>) {
+                    err = e;
+                    reactor->stop();
+                },
+                Headers{}, Settings{}, reactor, logger);
+        reactor->run();
+        REQUIRE(err == SslError());
+    }
+}
+
 #endif
 
 TEST_CASE("http::request() fails if fails request_send()") {
diff --git a/test/ooni/web_connectivity.cpp b/test/ooni/web_connectivity.cpp
index da9f41d0..cc615207 100644
--- a/test/ooni/web_connectivity.cpp
+++ b/test/ooni/web_connectivity.cpp
@@ -24,4 +24,32 @@ TEST_CASE("Web connectivity works as expected") {
         reactor->run();
         REQUIRE(okay);
     }
+
+    SECTION("For website that uses SSLv2") {
+        // See https://github.com/chromium/badssl.com/issues/20
+        auto reactor = Reactor::make();
+        bool okay = false;
+        ooni::web_connectivity("https://ssl-v2.badssl.com:1002", Settings{},
+                [&](SharedPtr<report::Entry> entry) {
+                    okay = ((*entry)["failure"] == nullptr);
+                    reactor->stop();
+                },
+                reactor, logger);
+        reactor->run();
+        REQUIRE(okay);
+    }
+
+    SECTION("For website that uses SSLv3") {
+        // See https://github.com/chromium/badssl.com/issues/20
+        auto reactor = Reactor::make();
+        bool okay = false;
+        ooni::web_connectivity("https://ssl-v3.badssl.com:1003", Settings{},
+                [&](SharedPtr<report::Entry> entry) {
+                    okay = ((*entry)["failure"] == nullptr);
+                    reactor->stop();
+                },
+                reactor, logger);
+        reactor->run();
+        REQUIRE(okay);
+    }
 }
```

It was meant to be pushed on top of #1365, yet it seems that the badssl endpoints are not working correctly (they reset the connection?! &mdash; see chromium/badssl.com#20), so it would be better to find other hosts that use SSLv2 or SSLv3 for running the tests with. I've asked @darkk for help in doing that (we may also want to seek for SSL errors in old reports).

FTR, the failures I see with badssl.com hosts are the following:

```
$ ./example_http_request -vv https://ssl-v3.badssl.com:1003
[D] initializing libevent once
[D] resolve_hostname: ssl-v3.badssl.com
[D] resolve_hostname: ipv4...
[D] getaddrinfo('ssl-v3.badssl.com') => error: code=0, reason=''
[D] resolve_hostname: ipv4... done
[D] resolve_hostname: ipv6...
[D] getaddrinfo('ssl-v3.badssl.com') => error: code=2024, reason='dns_host_or_service_not_provided_or_not_known'
[D] resolve_hostname: ipv6... done
[D] connect_base 104.154.89.105:1003
[D] connect() in progress...
[D] connect time: 0.144962
[D] ssl: creating SSL_CTX with bundle: '/usr/local/etc/openssl/cert.pem'
[D] ssl: handshake...
[D] ssl: handshake error: connection_reset
Error: connection_reset
[!] reactor: no pending and/or active events

$ ./example_http_request -C -vv https://ssl-v3.badssl.com:1003
[D] initializing libevent once
[D] resolve_hostname: ssl-v3.badssl.com
[D] resolve_hostname: ipv4...
[D] getaddrinfo('ssl-v3.badssl.com') => error: code=0, reason=''
[D] resolve_hostname: ipv4... done
[D] resolve_hostname: ipv6...
[D] getaddrinfo('ssl-v3.badssl.com') => error: code=2024, reason='dns_host_or_service_not_provided_or_not_known'
[D] resolve_hostname: ipv6... done
[D] connect_base 104.154.89.105:1003
[D] connect() in progress...
[D] connect time: 0.151462
[D] ssl: creating SSL_CTX with bundle: '/usr/local/etc/openssl/cert.pem'
Re-enabling SSLv2 and SSLv3
[D] ssl: handshake...
[D] ssl: handshake error: connection_reset
Error: connection_reset
[!] reactor: no pending and/or active events

$ curl -k -vv https://ssl-v3.badssl.com:1003
* Rebuilt URL to: https://ssl-v3.badssl.com:1003/
*   Trying 104.154.89.105...
* TCP_NODELAY set
* Connected to ssl-v3.badssl.com (104.154.89.105) port 1003 (#0)
* WARNING: disabling hostname validation also disables SNI.
* Server aborted the SSL handshake
* Closing connection 0
curl: (35) Server aborted the SSL handshake

$ curl -2 -k -vv https://ssl-v3.badssl.com:1003
* Rebuilt URL to: https://ssl-v3.badssl.com:1003/
*   Trying 104.154.89.105...
* TCP_NODELAY set
* Connected to ssl-v3.badssl.com (104.154.89.105) port 1003 (#0)
* Your version of the OS does not support SSLv2
* Closing connection 0
curl: (35) Your version of the OS does not support SSLv2

$ curl -3 -k -vvvvv https://ssl-v3.badssl.com:1003
* Rebuilt URL to: https://ssl-v3.badssl.com:1003/
*   Trying 104.154.89.105...
* TCP_NODELAY set
* Connected to ssl-v3.badssl.com (104.154.89.105) port 1003 (#0)
* WARNING: disabling hostname validation also disables SNI.
* Server aborted the SSL handshake
* Closing connection 0
curl: (35) Server aborted the SSL handshake
```

(I am now wondering whether the errors I am seeing have more with to do with my system not supporting SSLv2 and SSLv3 than with anything else. I do also wonder whether the way in which we compile libressl for mobile is such that we will get support for SSLv2 and SSLv3 or not.)

**Comment by bassosimone** [comment]
Also:

```$ openssl s_client -ssl3 -host ssl-v3.badssl.com -port 1003 -debug
CONNECTED(00000003)
write to 0x7fbf6de0e820 [0x7fbf6f016200] (94 bytes => 94 (0x5E))
0000 - 16 03 00 00 59 01 00 00-55 03 00 59 c0 11 c9 89   ....Y...U..Y....
0010 - 80 a1 19 f5 d3 36 12 ca-d0 c4 eb 10 c1 5a c6 f5   .....6.......Z..
0020 - b2 10 7b 16 2e 88 46 0f-eb 5f 02 00 00 2e 00 39   ..{...F.._.....9
0030 - 00 38 00 35 00 16 00 13-00 0a 00 33 00 32 00 2f   .8.5.......3.2./
0040 - 00 9a 00 99 00 96 00 05-00 04 00 15 00 12 00 09   ................
0050 - 00 14 00 11 00 08 00 06-00 03 00 ff 01            .............
005e - <SPACES/NULS>
read from 0x7fbf6de0e820 [0x7fbf6f011800] (5 bytes => -1 (0xFFFFFFFFFFFFFFFF))
write:errno=54

$ python
Python 2.7.10 (default, Feb  7 2017, 00:08:15) 
[GCC 4.2.1 Compatible Apple LLVM 8.0.0 (clang-800.0.34)] on darwin
Type "help", "copyright", "credits" or "license" for more information.
>>> import errno
>>> errno.errorcode[54]
'ECONNRESET'
```

So, yes, it's actually a reset, also according to OpenSSL. Also:

```
$ sudo tcpdump -n 'host 104.154.89.105'
tcpdump: data link type PKTAP
tcpdump: verbose output suppressed, use -v or -vv for full protocol decode
listening on pktap, link-type PKTAP (Apple DLT_PKTAP), capture size 262144 bytes
20:36:51.244912 IP 192.168.1.4.52719 > 104.154.89.105.1003: Flags [S], seq 2304998175, win 65535, options [mss 1460,nop,wscale 5,nop,nop,TS val 1845221822 ecr 0,sackOK,eol], length 0
20:36:51.395137 IP 104.154.89.105.1003 > 192.168.1.4.52719: Flags [S.], seq 1211854851, ack 2304998176, win 28160, options [mss 1420,sackOK,TS val 3771864954 ecr 1845221822,nop,wscale 7], length 0
20:36:51.395207 IP 192.168.1.4.52719 > 104.154.89.105.1003: Flags [.], ack 1, win 4136, options [nop,nop,TS val 1845221972 ecr 3771864954], length 0
20:36:51.395558 IP 192.168.1.4.52719 > 104.154.89.105.1003: Flags [P.], seq 1:95, ack 1, win 4136, options [nop,nop,TS val 1845221972 ecr 3771864954], length 94
20:36:51.541766 IP 104.154.89.105.1003 > 192.168.1.4.52719: Flags [.], ack 95, win 220, options [nop,nop,TS val 3771864991 ecr 1845221972], length 0
20:36:51.542305 IP 104.154.89.105.1003 > 192.168.1.4.52719: Flags [R.], seq 1, ack 95, win 220, options [nop,nop,TS val 3771864991 ecr 1845221972], length 0
^C
6 packets captured
20 packets received by filter
0 packets dropped by kernel
```

**Comment by bassosimone** [comment]
Moving to `v0.8.0-beta` or later since this is not straightforward.

**Comment by bassosimone** [comment]
So, I guess we'll never write an _integration test_ for this functionality.
